{
  "event_id": "event_iorb_2026_04_23",
  "title": "iorb / interest on reserve balances / fed policy | Market Notice | Interest on Reserve Balances",
  "topic": "market structure",
  "event_type": "market_notice",
  "summary": "The Interest on Reserve Balances (IORB) rate remained unchanged at 3.65% on April 23, 2026, holding flat from the prior day and the preceding several days.",
  "status": "open",
  "created_at": "2026-04-29T06:30:42.959890Z",
  "updated_at": "2026-04-29T06:30:42.959890Z",
  "record_ids": [
    "iorb_2026_04_23"
  ],
  "source_domains": [
    "fred.stlouisfed.org"
  ],
  "keywords": [
    "iorb",
    "interest-on-reserve-balances",
    "fed-policy",
    "monetary-implementation",
    "reserve-rates",
    "floor-system"
  ],
  "quant_links": [],
  "confidence": 1.0
}