{
  "event_id": "event_000149315226018836",
  "title": "sec filing / 8 k / corporate governance | Regulatory Guidance | Greenpro Capital Corp. Form 8-K — Departure of Director",
  "topic": "macro catalysts",
  "event_type": "regulatory_guidance",
  "summary": "Greenpro Capital Corp. filed an 8-K on April 22, 2026 disclosing the resignation of Christopher Yu Nien Wong from its Board of Directors, effective April 30, 2026, along with his departure from the Audit, Compensation, and Nominating and Corporate Governance Committees. The filing states the resignation was not the result of any disagreement with the company. The company is evaluating candidates to fill the vacancy.",
  "status": "open",
  "created_at": "2026-04-30T21:08:39.752281Z",
  "updated_at": "2026-04-30T21:08:39.752281Z",
  "record_ids": [
    "000149315226018836"
  ],
  "source_domains": [
    "sec.gov"
  ],
  "keywords": [
    "sec-filing",
    "8-k",
    "corporate-governance",
    "board-resignation",
    "nasdaq",
    "grnq"
  ],
  "quant_links": [],
  "confidence": 1.0
}