{
  "event_id": "event_seed_crawl_bankofcanada_browse_p",
  "title": "bank of canada / monetary policy / interest rates | Central Bank Communication | Bank of Canada Summary of Deliberations Release - April 1, 2...",
  "topic": "macro catalysts",
  "event_type": "central_bank_communication",
  "summary": "This is a media advisory announcing that the Bank of Canada will publish a summary of deliberations on April 1, 2026, pertaining to its interest rate decision from March 18, 2026. The source is a 'Browse press' page containing minimal content—just a single announcement line with no substantive economic detail, policy context, or market-relevant data.",
  "status": "open",
  "created_at": "2026-04-27T10:28:45.314109Z",
  "updated_at": "2026-04-27T10:28:45.314109Z",
  "record_ids": [
    "seed_crawl_bankofcanada_browse_press_edccc823cd4c51d2"
  ],
  "source_domains": [
    ""
  ],
  "keywords": [
    "bank-of-canada",
    "monetary-policy",
    "interest-rates",
    "central-bank",
    "canada",
    "media-advisory"
  ],
  "quant_links": [],
  "confidence": 1.0
}