{
  "event_id": "event_seed_crawl_ecb.europa_economic_b",
  "title": "ecb / ecb rate decision / inflation | Economic Commentary | Economic Bulletin Issue 2, 2026",
  "topic": "macro catalysts",
  "event_type": "economic_commentary",
  "summary": "The ECB Governing Council kept interest rates unchanged at its 19 March 2026 meeting, citing significant uncertainty from the war in the Middle East creating upside inflation risks and downside growth risks. ECB staff revised up their inflation projections to 2.6% for 2026 (vs prior path) and revised down GDP growth to 0.9% for 2026, reflecting higher energy prices and disruptions to commodity markets, real incomes and confidence.",
  "status": "open",
  "created_at": "2026-04-27T10:07:57.465409Z",
  "updated_at": "2026-04-27T10:07:57.465409Z",
  "record_ids": [
    "seed_crawl_ecb.europa_economic_bulletin_issue_2_2026_f4a6fa2769b9586a"
  ],
  "source_domains": [
    "www.ecb.europa.eu"
  ],
  "keywords": [
    "ecb",
    "ecb-rate-decision",
    "inflation",
    "gdp-growth",
    "middle-east-war",
    "energy-prices",
    "macro-catalysts",
    "euro-area"
  ],
  "quant_links": [],
  "confidence": 1.0
}