{
  "event_id": "event_seed_crawl_newyorkfed_the_precri",
  "title": "federal reserve / monetary policy / market structure | Research Paper | The Pre-Crisis Monetary Policy Implementation Framework",
  "topic": "market structure",
  "event_type": "research_paper",
  "summary": "This Federal Reserve Bank of New York Staff Report (No. 809, March 2017, revised May 2018) describes the Federal Reserve's monetary policy operating framework before the balance sheet expansion during the financial crisis. The report explains how the FOMC set a target for the overnight federal funds rate and how the New York Fed's open market trading desk conducted daily forecasting and repo operations with primary dealers to maintain the equilibrium rate close to its target. The pre-crisis framework relied on scarce aggregate reserves where small changes affected fed funds rates, required substantial intraday overdrafts, and became unsustainable once the Fed's balance sheet expanded.",
  "status": "open",
  "created_at": "2026-04-27T06:43:27.412313Z",
  "updated_at": "2026-04-27T06:43:27.412313Z",
  "record_ids": [
    "seed_crawl_newyorkfed_the_precrisis_monetary_policy_implementation_11cc3f40572543d6"
  ],
  "source_domains": [
    "www.newyorkfed.org"
  ],
  "keywords": [
    "federal-reserve",
    "monetary-policy",
    "market-structure",
    "federal-funds",
    "pre-crisis-framework",
    "open-market-operations",
    "balance-sheet",
    "reserve-management",
    "new-york-fed",
    "research-paper"
  ],
  "quant_links": [],
  "confidence": 1.0
}